<?xml version="1.0" encoding="UTF-8"?>
<schema xmlns="http://www.w3.org/2001/XMLSchema"
        targetNamespace="http://www.example.com/flowers"
        xmlns:tns="http://www.example.com/flowers"
        elementFormDefault="qualified">

    <element name="flowers">
        <complexType>
            <sequence>
                <element ref="tns:flower" minOccurs="2" maxOccurs="unbounded" />
            </sequence>
        </complexType>
    </element>



    <complexType name="Flower">
        <sequence>
            <element name="name" type="string"/>
            <element name="origin" type="string"/>
            <element name="visual-parameters" type="tns:Visual"/>
        </sequence>
        <attribute name="id" use="required">
            <simpleType>
                <restriction base="ID">
                    <pattern value="([a-z])[0-9]"/>
                </restriction>
            </simpleType>
        </attribute>
    </complexType>


    <complexType name="GardenFlower">
        <complexContent>
            <extension base="tns:Flower">
                <sequence>
                    <element name="growing-tips" type="tns:Growing"/>
                    <element name="multiplying" type="tns:Multiplying"/>
                </sequence>
                <attribute name="soil" use="optional" default="dirt" type="tns:Soil"/>
            </extension>
        </complexContent>
    </complexType>


    <complexType name="Visual">
        <sequence>
            <element name="stem-color" type="string"/>
            <element name="leaf-color" type="string"/>
            <element name="plant-size" type="integer"/>
        </sequence>
    </complexType>

    <complexType name="Growing">
        <sequence>
            <element name="temperature" type="integer"/>
            <element name="watering" type="integer"/>
        </sequence>
    </complexType>

    <simpleType name="Multiplying">
        <restriction base="string">
            <enumeration value="leaf"/>
            <enumeration value="stalk"/>
            <enumeration value="seed"/>
        </restriction>
    </simpleType>

    <simpleType name="Soil">
        <restriction base="string">
            <enumeration value="unpaved"/>
            <enumeration value="podzolic"/>
            <enumeration value="soddy-podzolic"/>
        </restriction>
    </simpleType>


    <element name="flower" type="tns:Flower" abstract="true"/>
    <element name="garden-flower" type="tns:GardenFlower" substitutionGroup="tns:flower"/>
</schema>